{
  "schema_version": "PromiseDerivationWorksheet.v1",
  "produced_by": "manual:promise-derivation-stage-1",
  "worksheet_id": "worksheet-repotrace-queue-preview-v1",
  "system_name": "RepoTrace DownloadHome queue preview flow",
  "purpose": "Derive promise candidates for collection selection to queue preview correctness before scan planning.",
  "actors": [
    "user",
    "collection picker UI",
    "queue rule lookup",
    "queue preview"
  ],
  "assets_or_rights": [
    "correct queued track count",
    "selection-to-preview consistency",
    "predictable queue setup"
  ],
  "transition_families": [
    "pick collection",
    "queue lookup",
    "preview render"
  ],
  "representations": [
    "incident markdown",
    "retrieval result",
    "witness set",
    "debug screenshot"
  ],
  "consistency_boundaries": [
    "screenCollection/runtimeCollection/ruleCollection agreement",
    "queue rule lookup key normalization",
    "preview count equals selected collection library count"
  ],
  "settlement_horizons": [
    "selection change through first queue preview render",
    "lookup completion through first stable preview frame"
  ],
  "admin_or_external_surfaces": [
    "diagnostics export",
    "incident ingestion",
    "eval fixture repotrace-current-incident"
  ],
  "candidate_promises": [
    {
      "candidate_id": "cand-repotrace-queue-lookup-consistency",
      "statement": "Selecting a collection yields a queue lookup that resolves the same collection identity used by the UI.",
      "actor_scope": "collection picker UI + queue rule lookup",
      "protected_state": "selected collection identity remains equivalent across screen, runtime, and rule lookup layers",
      "interaction_families": [
        "pick collection",
        "queue lookup"
      ],
      "consistency_boundaries": [
        "screenCollection/runtimeCollection/ruleCollection agreement",
        "queue rule lookup key normalization"
      ],
      "rationale": "Incident evidence shows ui/runtime are aligned while rule lookup diverges; this is the highest-leverage correctness contract.",
      "priority": "high",
      "confidence": 0.87,
      "status": "accepted"
    },
    {
      "candidate_id": "cand-repotrace-preview-count-projection",
      "statement": "Queue preview renders the rule-derived queued track count for the selected collection.",
      "actor_scope": "queue rule lookup + queue preview",
      "protected_state": "rendered queued track count equals the resolved rule count for current selection",
      "interaction_families": [
        "preview render"
      ],
      "consistency_boundaries": [
        "preview count equals selected collection library count"
      ],
      "rationale": "Useful follow-up candidate after lookup identity consistency is confirmed.",
      "priority": "medium",
      "confidence": 0.74,
      "status": "deferred"
    }
  ],
  "open_questions": [
    "Does lookup normalization ever alter ROAD_TRIP_MIX before rule table access?",
    "Should preview-count agreement be promoted once lookup-key agreement is stable across traces?"
  ],
  "evidence_refs": {
    "source_incident_ids": [
      "incident-20260312-220604"
    ],
    "retrieval_refs": [
      "diagnostics/retrieval_results/incident-20260312-220604.json"
    ],
    "witness_refs": [
      "diagnostics/evidence/witness_sets/incident-20260312-220604.witness_set.json"
    ],
    "fixture_refs": [
      "eval/fixtures/repotrace-current-incident.yaml"
    ],
    "verifier_refs": [
      "manual:promise-derivation-stage-1"
    ]
  },
  "status": "accepted",
  "created_at": "2026-03-24T16:00:00Z",
  "updated_at": "2026-03-24T16:00:00Z"
}
